{
  "format": "world-hub.module/v1",
  "id": "example.soft-ui-desktop",
  "version": "0.3.0",
  "license": "MIT",
  "platforms": ["win32-x64"],
  "runtime": { "kind": "node", "entry": "program.mjs" },
  "bridges": ["main"],
  "provides": [{ "id": "soft-ui.windows", "version": "1.0.0" }],
  "requires": [],
  "permissions": { "filesystem": "instance-state", "network": ["hub-loopback", "loopback-listen"], "processes": "owned-children" }
}
