{
  "format": "world-hub.module/v1",
  "id": "demo.source",
  "version": "1.0.3",
  "license": "Apache-2.0",
  "platforms": [
    "win32-x64",
    "linux-x64",
    "darwin-arm64"
  ],
  "runtime": {
    "kind": "node",
    "entry": "program.mjs"
  },
  "bridges": [
    "main"
  ],
  "provides": [
    {
      "id": "text.read",
      "version": "1.0.0"
    }
  ],
  "requires": [],
  "permissions": {
    "filesystem": "instance-state",
    "network": [
      "hub-loopback"
    ],
    "processes": "none"
  }
}
