{
  "format": "world-hub.module/v1",
  "id": "demo.stats",
  "version": "1.0.1",
  "license": "MIT",
  "platforms": ["win32-x64", "linux-x64", "darwin-arm64"],
  "runtime": { "kind": "python", "entry": "program.py" },
  "bridges": ["main"],
  "provides": [{ "id": "text.statistics", "version": "1.0.0" }],
  "requires": [],
  "permissions": { "filesystem": "instance-state", "network": ["hub-loopback"], "processes": "none" }
}
